{
  "schema": "shiftory.benchmark-agent-quality-candidate-evaluation/v1",
  "case_id": "binary-asset-replacement",
  "rubric_version": 1,
  "candidate_id": "synthetic_adversarial",
  "candidate_kind": "synthetic_adversarial",
  "explanation_sha256": "196351e79e05739d572952ff74af5210c8d5ee77e42903da3462aae89607c592",
  "claims": [
    {
      "overlaps_with": [],
      "evidence_anchor_cited": [
        "conceptual-unit:icon.dat#1"
      ],
      "annotation_provenance": {
        "actor_type": "agent",
        "actor": {
          "name": "GitHub Copilot CLI (Claude Sonnet 5)",
          "organization": "GitHub",
          "model": "claude-sonnet-5",
          "tool": "copilot-cli",
          "version": "1.0.80"
        },
        "method": "Manual single-pass authoring while implementing this benchmark layer; provisional until independently re-reviewed.",
        "timestamp": "2026-09-02T00:00:00Z"
      },
      "claim_id": "c-logo-updated",
      "source_item_id": "logo-updated",
      "field": "/items/0/statement",
      "maps_to_required_fact_id": "content-meaning-not-available",
      "verdict": "unsupported",
      "materiality": 5,
      "confidence_expressed": "extracted",
      "confidence_appropriate": false,
      "rationale": "Confidently asserts specific visual/semantic content (brand colors, modern look) that the evidence -- opaque binary blob hashes only -- cannot support.",
      "start": 0,
      "end": 141,
      "excerpt_sha256": "d336f39d0e668f74ff7c8f0d303b8dc6a6982dc0d42460b404b241dfbda3c1cc"
    }
  ],
  "audit_coverage": [
    {
      "field": "/summary",
      "claim_ids": [],
      "decomposition_complete": true,
      "non_claim_rationale": "Restates or labels a material claim already recorded elsewhere for this item; not an independently material assertion."
    },
    {
      "field": "/items/0/title",
      "claim_ids": [],
      "decomposition_complete": true,
      "non_claim_rationale": "Restates or labels a material claim already recorded elsewhere for this item; not an independently material assertion."
    },
    {
      "field": "/items/0/statement",
      "claim_ids": [
        "c-logo-updated"
      ],
      "decomposition_complete": true
    },
    {
      "field": "/items/1/title",
      "claim_ids": [],
      "decomposition_complete": true,
      "non_claim_rationale": "Restates or labels a material claim already recorded elsewhere for this item; not an independently material assertion."
    },
    {
      "field": "/items/1/statement",
      "claim_ids": [],
      "decomposition_complete": true,
      "non_claim_rationale": "Generic asset-pipeline filler with no material, checkable behavioral assertion; correctly not decomposed into a claim."
    }
  ]
}
