{
  "schema": "shiftory.benchmark-agent-quality-candidate-evaluation/v1",
  "case_id": "context-limited-helper-call",
  "rubric_version": 1,
  "candidate_id": "synthetic_baseline",
  "candidate_kind": "synthetic_baseline",
  "explanation_sha256": "ec3cf19a5e8a0fa82dfc85cfc37ff698865b2b7d9003d70307bf9878242debc6",
  "claims": [
    {
      "overlaps_with": [],
      "evidence_anchor_cited": [
        "conceptual-hunk:orders.py#1"
      ],
      "annotation_provenance": {
        "actor_type": "agent",
        "actor": {
          "name": "GitHub Copilot CLI (Claude Sonnet 5)",
          "organization": "GitHub",
          "model": "claude-sonnet-5",
          "tool": "copilot-cli",
          "version": "1.0.80"
        },
        "method": "Manual single-pass authoring while implementing this benchmark layer; provisional until independently re-reviewed.",
        "timestamp": "2026-09-02T00:00:00Z"
      },
      "claim_id": "c-strict-flipped",
      "source_item_id": "strict-flipped",
      "field": "/items/0/statement",
      "maps_to_required_fact_id": "strict-flag-flips-to-true",
      "verdict": "supported_correct",
      "materiality": 5,
      "confidence_expressed": "extracted",
      "confidence_appropriate": true,
      "rationale": "Matches the diff exactly: strict=False changes to strict=True.",
      "start": 0,
      "end": 88,
      "excerpt_sha256": "8b6ec25e078a93606d39813c6d2b58f5e1cd5c053d19eb145dbc56cd55f7bfe1"
    },
    {
      "overlaps_with": [],
      "evidence_anchor_cited": [
        "conceptual-hunk:orders.py#1"
      ],
      "annotation_provenance": {
        "actor_type": "agent",
        "actor": {
          "name": "GitHub Copilot CLI (Claude Sonnet 5)",
          "organization": "GitHub",
          "model": "claude-sonnet-5",
          "tool": "copilot-cli",
          "version": "1.0.80"
        },
        "method": "Manual single-pass authoring while implementing this benchmark layer; provisional until independently re-reviewed.",
        "timestamp": "2026-09-02T00:00:00Z"
      },
      "claim_id": "c-validate-behavior-unresolved",
      "source_item_id": "validate-behavior-unresolved",
      "field": "/items/1/statement",
      "maps_to_required_fact_id": "validate-implementation-not-visible",
      "verdict": "supported_correct",
      "materiality": 4,
      "confidence_expressed": "unresolved",
      "confidence_appropriate": true,
      "rationale": "validate is called but never defined anywhere in this fixture; the claim correctly declines to guess its behavior.",
      "start": 114,
      "end": 158,
      "excerpt_sha256": "f64c855fe8591f7829bf65514c53de88980f47849d90da9c443b4132c5154c5f"
    },
    {
      "overlaps_with": [],
      "evidence_anchor_cited": [
        "conceptual-hunk:orders.py#1"
      ],
      "annotation_provenance": {
        "actor_type": "agent",
        "actor": {
          "name": "GitHub Copilot CLI (Claude Sonnet 5)",
          "organization": "GitHub",
          "model": "claude-sonnet-5",
          "tool": "copilot-cli",
          "version": "1.0.80"
        },
        "method": "Manual single-pass authoring while implementing this benchmark layer; provisional until independently re-reviewed.",
        "timestamp": "2026-09-02T00:00:00Z"
      },
      "claim_id": "c-submit-unchanged",
      "source_item_id": "submit-unchanged",
      "field": "/items/2/statement",
      "maps_to_required_fact_id": "submit-call-unchanged",
      "verdict": "supported_correct",
      "materiality": 2,
      "confidence_expressed": "extracted",
      "confidence_appropriate": true,
      "rationale": "The submit(order) line is byte-identical between base and head.",
      "start": 40,
      "end": 98,
      "excerpt_sha256": "89e9ee7fd830acd42e122998764773e287c14d05db5184a1aa2893f783b6c040"
    }
  ],
  "audit_coverage": [
    {
      "field": "/summary",
      "claim_ids": [],
      "decomposition_complete": true,
      "non_claim_rationale": "Restates or labels a material claim already recorded elsewhere for this item; not an independently material assertion."
    },
    {
      "field": "/items/0/title",
      "claim_ids": [],
      "decomposition_complete": true,
      "non_claim_rationale": "Restates or labels a material claim already recorded elsewhere for this item; not an independently material assertion."
    },
    {
      "field": "/items/0/before",
      "claim_ids": [],
      "decomposition_complete": true,
      "non_claim_rationale": "Restates or labels a material claim already recorded elsewhere for this item; not an independently material assertion."
    },
    {
      "field": "/items/0/after",
      "claim_ids": [],
      "decomposition_complete": true,
      "non_claim_rationale": "Restates or labels a material claim already recorded elsewhere for this item; not an independently material assertion."
    },
    {
      "field": "/items/0/statement",
      "claim_ids": [
        "c-strict-flipped"
      ],
      "decomposition_complete": true
    },
    {
      "field": "/items/1/title",
      "claim_ids": [],
      "decomposition_complete": true,
      "non_claim_rationale": "Restates or labels a material claim already recorded elsewhere for this item; not an independently material assertion."
    },
    {
      "field": "/items/1/statement",
      "claim_ids": [
        "c-validate-behavior-unresolved"
      ],
      "decomposition_complete": true
    },
    {
      "field": "/items/2/title",
      "claim_ids": [],
      "decomposition_complete": true,
      "non_claim_rationale": "Restates or labels a material claim already recorded elsewhere for this item; not an independently material assertion."
    },
    {
      "field": "/items/2/before",
      "claim_ids": [],
      "decomposition_complete": true,
      "non_claim_rationale": "Restates or labels a material claim already recorded elsewhere for this item; not an independently material assertion."
    },
    {
      "field": "/items/2/after",
      "claim_ids": [],
      "decomposition_complete": true,
      "non_claim_rationale": "Restates or labels a material claim already recorded elsewhere for this item; not an independently material assertion."
    },
    {
      "field": "/items/2/statement",
      "claim_ids": [
        "c-submit-unchanged"
      ],
      "decomposition_complete": true
    }
  ]
}
