{
  "schema": "shiftory.benchmark-agent-quality-candidate-evaluation/v1",
  "case_id": "cross-file-validation-edit",
  "rubric_version": 1,
  "candidate_id": "synthetic_adversarial",
  "candidate_kind": "synthetic_adversarial",
  "explanation_sha256": "e6054859de8a5b7afcb742743fa6fc5f6e5556afd1aee56293a84c4d22b467f1",
  "claims": [
    {
      "overlaps_with": [],
      "evidence_anchor_cited": [
        "conceptual-hunk:validators.py#1",
        "conceptual-hunk:utils.py#1"
      ],
      "annotation_provenance": {
        "actor_type": "agent",
        "actor": {
          "name": "GitHub Copilot CLI (Claude Sonnet 5)",
          "organization": "GitHub",
          "model": "claude-sonnet-5",
          "tool": "copilot-cli",
          "version": "1.0.80"
        },
        "method": "Manual single-pass authoring while implementing this benchmark layer; provisional until independently re-reviewed.",
        "timestamp": "2026-09-02T00:00:00Z"
      },
      "claim_id": "c-behavior-unchanged",
      "source_item_id": "email-check-moved",
      "field": "/items/0/statement",
      "maps_to_required_fact_id": "not-a-behavior-preserving-move",
      "verdict": "contradicted",
      "materiality": 5,
      "confidence_expressed": "extracted",
      "confidence_appropriate": false,
      "rationale": "Directly contradicts the diff: the new utils.py function uses a bare '@ in value' check, materially weaker than the old anchored regex.",
      "start": 96,
      "end": 132,
      "excerpt_sha256": "2a82f245e7c04511557e5ca048c4ce7220d0aff73a7452083ccef6732ff6b062"
    },
    {
      "overlaps_with": [],
      "evidence_anchor_cited": [
        "conceptual-hunk:utils.py#1"
      ],
      "annotation_provenance": {
        "actor_type": "agent",
        "actor": {
          "name": "GitHub Copilot CLI (Claude Sonnet 5)",
          "organization": "GitHub",
          "model": "claude-sonnet-5",
          "tool": "copilot-cli",
          "version": "1.0.80"
        },
        "method": "Manual single-pass authoring while implementing this benchmark layer; provisional until independently re-reviewed.",
        "timestamp": "2026-09-02T00:00:00Z"
      },
      "claim_id": "c-relocated",
      "source_item_id": "email-check-moved",
      "field": "/items/0/statement",
      "maps_to_required_fact_id": "weaker-validate-email-added-to-utils",
      "verdict": "unsupported",
      "materiality": 3,
      "confidence_expressed": "extracted",
      "confidence_appropriate": false,
      "rationale": "Frames this as a mere relocation/reorganization; the diff shows different implementations were written, not a copy-move of the same code, and no reorganization rationale is present in the fixture.",
      "start": 19,
      "end": 94,
      "excerpt_sha256": "ff36f1f0be4a532bf8eecca8ac8c19d05de9c9d22ff8ec11d18ed830991d9afb"
    }
  ],
  "audit_coverage": [
    {
      "field": "/summary",
      "claim_ids": [],
      "decomposition_complete": true,
      "non_claim_rationale": "Restates or labels a material claim already recorded elsewhere for this item; not an independently material assertion."
    },
    {
      "field": "/items/0/title",
      "claim_ids": [],
      "decomposition_complete": true,
      "non_claim_rationale": "Restates or labels a material claim already recorded elsewhere for this item; not an independently material assertion."
    },
    {
      "field": "/items/0/before",
      "claim_ids": [],
      "decomposition_complete": true,
      "non_claim_rationale": "Restates or labels a material claim already recorded elsewhere for this item; not an independently material assertion."
    },
    {
      "field": "/items/0/after",
      "claim_ids": [],
      "decomposition_complete": true,
      "non_claim_rationale": "Restates or labels a material claim already recorded elsewhere for this item; not an independently material assertion."
    },
    {
      "field": "/items/0/statement",
      "claim_ids": [
        "c-behavior-unchanged",
        "c-relocated"
      ],
      "decomposition_complete": true
    },
    {
      "field": "/items/1/title",
      "claim_ids": [],
      "decomposition_complete": true,
      "non_claim_rationale": "Restates or labels a material claim already recorded elsewhere for this item; not an independently material assertion."
    },
    {
      "field": "/items/1/statement",
      "claim_ids": [],
      "decomposition_complete": true,
      "non_claim_rationale": "Generic project-organization filler with no material, checkable behavioral assertion; correctly not decomposed into a claim."
    }
  ]
}
