{
  "schema": "shiftory.benchmark-agent-quality-candidate-evaluation/v1",
  "case_id": "threshold-value-replacement",
  "rubric_version": 1,
  "candidate_id": "synthetic_baseline",
  "candidate_kind": "synthetic_baseline",
  "explanation_sha256": "7a2f8e3da1a7aa6602d2f35f3a03859ab36d30d60da2ae917435bde7f8621972",
  "claims": [
    {
      "overlaps_with": [],
      "evidence_anchor_cited": [
        "conceptual-hunk:client.py#1"
      ],
      "annotation_provenance": {
        "actor_type": "agent",
        "actor": {
          "name": "GitHub Copilot CLI (Claude Sonnet 5)",
          "organization": "GitHub",
          "model": "claude-sonnet-5",
          "tool": "copilot-cli",
          "version": "1.0.80"
        },
        "method": "Manual single-pass authoring while implementing this benchmark layer; provisional until independently re-reviewed.",
        "timestamp": "2026-09-02T00:00:00Z"
      },
      "claim_id": "c-timeout-shortened",
      "source_item_id": "timeout-shortened",
      "field": "/items/0/statement",
      "maps_to_required_fact_id": "timeout-shortened",
      "verdict": "supported_correct",
      "materiality": 4,
      "confidence_expressed": "extracted",
      "confidence_appropriate": true,
      "rationale": "timeout_seconds literally changes from 30 to 5 in the diff.",
      "start": 46,
      "end": 80,
      "excerpt_sha256": "9120518b5c11c57b88b2e53bfc357079ed1599ba525ed117eeb641581aff1ffd"
    },
    {
      "overlaps_with": [],
      "evidence_anchor_cited": [
        "conceptual-hunk:client.py#1"
      ],
      "annotation_provenance": {
        "actor_type": "agent",
        "actor": {
          "name": "GitHub Copilot CLI (Claude Sonnet 5)",
          "organization": "GitHub",
          "model": "claude-sonnet-5",
          "tool": "copilot-cli",
          "version": "1.0.80"
        },
        "method": "Manual single-pass authoring while implementing this benchmark layer; provisional until independently re-reviewed.",
        "timestamp": "2026-09-02T00:00:00Z"
      },
      "claim_id": "c-attempts-increased",
      "source_item_id": "attempts-increased",
      "field": "/items/1/statement",
      "maps_to_required_fact_id": "attempts-increased",
      "verdict": "supported_correct",
      "materiality": 5,
      "confidence_expressed": "extracted",
      "confidence_appropriate": true,
      "rationale": "max_attempts literally changes from 1 to 4; the surrounding for/except/sleep structure is unchanged, so this directly implies retrying.",
      "start": 0,
      "end": 107,
      "excerpt_sha256": "875f4731455354ea2fcc41c2abc6c90bd0bd8fd21dbc58dff7e6cb9d6a72ba86"
    },
    {
      "overlaps_with": [],
      "evidence_anchor_cited": [
        "conceptual-hunk:client.py#1"
      ],
      "annotation_provenance": {
        "actor_type": "agent",
        "actor": {
          "name": "GitHub Copilot CLI (Claude Sonnet 5)",
          "organization": "GitHub",
          "model": "claude-sonnet-5",
          "tool": "copilot-cli",
          "version": "1.0.80"
        },
        "method": "Manual single-pass authoring while implementing this benchmark layer; provisional until independently re-reviewed.",
        "timestamp": "2026-09-02T00:00:00Z"
      },
      "claim_id": "c-worst-case-latency",
      "source_item_id": "worst-case-latency-changed",
      "field": "/items/2/statement",
      "maps_to_required_fact_id": "worst-case-latency-implication",
      "verdict": "supported_correct",
      "materiality": 3,
      "confidence_expressed": "inferred",
      "confidence_appropriate": true,
      "rationale": "Follows arithmetically from the two changed constants and the unchanged loop/sleep(1) structure; correctly hedged as inferred rather than extracted.",
      "start": 49,
      "end": 151,
      "excerpt_sha256": "5915253a789de50c431dee0330d0ef9067547c55532e00291107c1dacd4b3387"
    }
  ],
  "audit_coverage": [
    {
      "field": "/summary",
      "claim_ids": [],
      "decomposition_complete": true,
      "non_claim_rationale": "Restates or labels a material claim already recorded elsewhere for this item; not an independently material assertion."
    },
    {
      "field": "/items/0/title",
      "claim_ids": [],
      "decomposition_complete": true,
      "non_claim_rationale": "Restates or labels a material claim already recorded elsewhere for this item; not an independently material assertion."
    },
    {
      "field": "/items/0/before",
      "claim_ids": [],
      "decomposition_complete": true,
      "non_claim_rationale": "Restates or labels a material claim already recorded elsewhere for this item; not an independently material assertion."
    },
    {
      "field": "/items/0/after",
      "claim_ids": [],
      "decomposition_complete": true,
      "non_claim_rationale": "Restates or labels a material claim already recorded elsewhere for this item; not an independently material assertion."
    },
    {
      "field": "/items/0/statement",
      "claim_ids": [
        "c-timeout-shortened"
      ],
      "decomposition_complete": true
    },
    {
      "field": "/items/1/title",
      "claim_ids": [],
      "decomposition_complete": true,
      "non_claim_rationale": "Restates or labels a material claim already recorded elsewhere for this item; not an independently material assertion."
    },
    {
      "field": "/items/1/before",
      "claim_ids": [],
      "decomposition_complete": true,
      "non_claim_rationale": "Restates or labels a material claim already recorded elsewhere for this item; not an independently material assertion."
    },
    {
      "field": "/items/1/after",
      "claim_ids": [],
      "decomposition_complete": true,
      "non_claim_rationale": "Restates or labels a material claim already recorded elsewhere for this item; not an independently material assertion."
    },
    {
      "field": "/items/1/statement",
      "claim_ids": [
        "c-attempts-increased"
      ],
      "decomposition_complete": true
    },
    {
      "field": "/items/2/title",
      "claim_ids": [],
      "decomposition_complete": true,
      "non_claim_rationale": "Restates or labels a material claim already recorded elsewhere for this item; not an independently material assertion."
    },
    {
      "field": "/items/2/before",
      "claim_ids": [],
      "decomposition_complete": true,
      "non_claim_rationale": "Restates or labels a material claim already recorded elsewhere for this item; not an independently material assertion."
    },
    {
      "field": "/items/2/after",
      "claim_ids": [],
      "decomposition_complete": true,
      "non_claim_rationale": "Restates or labels a material claim already recorded elsewhere for this item; not an independently material assertion."
    },
    {
      "field": "/items/2/statement",
      "claim_ids": [
        "c-worst-case-latency"
      ],
      "decomposition_complete": true
    }
  ]
}
